{
  "schemaVersion": "basebrief-receiver-check-result-v1",
  "receiver_task_status": "blocked",
  "repository_state_status": "not_applicable",
  "declared_checks_status": "blocked",
  "handoff_acceptance": "blocked",
  "repository": {
    "branch": "",
    "head": ""
  },
  "changed_files": {
    "expected": [],
    "actual": [],
    "missing": [],
    "unexpected": []
  },
  "declared_checks": [],
  "blocked_reason": "declared check path must be repository-relative"
}
